CloudID,CloudURL,Name,Extension,Tags
245,http://127.0.0.1:5001/local/meme/245,comforting the scarlett witch,jpg,"scarlett witch,wanda,mcu,marvel"
247,http://127.0.0.1:5001/local/meme/247,was it real,jpg,"new rockstars,thumbnail,joker"
248,http://127.0.0.1:5001/local/meme/248,love is love,jpg,"gay,homophobic dog,homophobia,love"
249,http://127.0.0.1:5001/local/meme/249,fantastic four noodles,jpg,"scarlett witch,wanda,mcu,marvel"
250,http://127.0.0.1:5001/local/meme/250,miley cyrus as scarlett witch,jpg,"scarlett witch,smiling,happy,excited,miley cyrus,marvel,mcu"
251,http://127.0.0.1:5001/local/meme/251,she hulk carrying man,jpg,"shehulk,marvel,mcu,pegging,man,powerful"
252,http://127.0.0.1:5001/local/meme/252,woman with large bob,jpg,"bob,side eye,concerned,suspicious"
254,http://127.0.0.1:5001/local/meme/254,drake with nails,jpg,"gay,drake,bbl drake,embarassed,happy,satisfied"
257,http://127.0.0.1:5001/local/meme/257,live wong reaction,jpg,"wong,honest reaction,marvel,mcu,reaction"
258,http://127.0.0.1:5001/local/meme/258,was it his plan,jpg,"new rockstars,thumbnail,plan,cooked,suspicious,concerned"
260,http://127.0.0.1:5001/local/meme/260,is earth doomed,jpg,"new rockstars,thumbnail,doomed,done,sad"
262,http://127.0.0.1:5001/local/meme/262,gorr trying not to cough,jpg,"gorr,marvel,thor,mcu,confused,disgusted,embarassed"
263,http://127.0.0.1:5001/local/meme/263,gorr looking at phone,jpg,"gorr,phone,confused,disgusted,looking at phone,concerned"
264,http://127.0.0.1:5001/local/meme/264,what next,jpeg,"new rockstars,thumbnail,falcon,concerned"
265,http://127.0.0.1:5001/local/meme/265,scarlett witch with gun,jpg,"scarlett wtich,wanda,marvel,mcu,gun,concerned"
266,http://127.0.0.1:5001/local/meme/266,where is the body,jpg,"new rockstars,thumbnail,marvel,mcu"
267,http://127.0.0.1:5001/local/meme/267,homeless,jpg,"new rockstars,thumbnail"
268,http://127.0.0.1:5001/local/meme/268,facebook warned me about people like you,jpg,"gay,homophobia,homophobic dog"
269,http://127.0.0.1:5001/local/meme/269,why cant you be normal,jpg,"gay,homophobia,homophobic dog"
270,http://127.0.0.1:5001/local/meme/270,emoji as a comedian,jpg,"satisfied,happy,ate,cleared,gagged"
272,http://127.0.0.1:5001/local/meme/272,if I wake up one more time,jpg,"sad,unhappy,depressed,done,tired"
273,http://127.0.0.1:5001/local/meme/273,I cant do it anymore,jpg,"sad,unhappy,depressed,done,tired"
274,http://127.0.0.1:5001/local/meme/274,I was thinking and then I started crying,jpg,"sad,unhappy,depressed,done,tired"
275,http://127.0.0.1:5001/local/meme/275,at this point what is the point,jpg,"sad,unhappy,depressed,done,tired"
276,http://127.0.0.1:5001/local/meme/276,donkey smirking,jpg,"donkey,shrek,happy,ate,cleared"
277,http://127.0.0.1:5001/local/meme/277,christian walker flipping the rainbow flag,jpg,"gay,homophobia,rainbow flag,christian walker"
278,http://127.0.0.1:5001/local/meme/278,are you guys lgbt or something,jpg,"ma,gay,homophobia,suspicious,concerned,octavia spencer"
279,http://127.0.0.1:5001/local/meme/279,lgbt always remember your destination,jpg,"pride month,gay,homophobia,destination"
282,http://127.0.0.1:5001/local/meme/282,awks,jpg,"awkard,confused,concerned,embarassed,idris elba,daniel craig"
283,http://127.0.0.1:5001/local/meme/283,sigma male smiling,jpg,"sigma male,smiling,alpha,happy"
284,http://127.0.0.1:5001/local/meme/284,what if im gay,jpg,"gay,homophobia,homophobic dog"
285,http://127.0.0.1:5001/local/meme/285,lets hope its just a phase,jpg,"gay,homophobia,homophobic dog"
288,http://127.0.0.1:5001/local/meme/288,dont tell me youre one of them,jpg,"gay,homophobia,homophobic dog"
289,http://127.0.0.1:5001/local/meme/289,man in suit posing,jpg,"happy,satisfied,ate,posing"
290,http://127.0.0.1:5001/local/meme/290,as long as it isnt your whole personality,jpg,"gay,homophobia,homophobic dog"
291,http://127.0.0.1:5001/local/meme/291,do you guys just put woke infront of everything,jpg,"woke,marvel,mcu,antman"
292,http://127.0.0.1:5001/local/meme/292,cat with nerd glasses,jpg,"cat,nerd,well actually"
293,http://127.0.0.1:5001/local/meme/293,scarlett witch ate,jpg,
295,http://127.0.0.1:5001/local/meme/295,welcome to chick fil a,jpg,"gay,homophobia,homophobic dog"
296,http://127.0.0.1:5001/local/meme/296,madison beer shocked,jpg,"confused,concerned,shocked,surprised,embarassed"
297,http://127.0.0.1:5001/local/meme/297,you wouldnt get it,jpg,joker
299,http://127.0.0.1:5001/local/meme/299,cat confused meme,jpg,"cat,confused,suspicious,concerned,side eye"
300,http://127.0.0.1:5001/local/meme/300,mr fantasic mid teleport,jpg,"marvel,mcu,side eye,"
301,http://127.0.0.1:5001/local/meme/301,scarlett witch smiling,jpg,"scarlett witch,wanda,marvel,mcu,happy,excited"
302,http://127.0.0.1:5001/local/meme/302,youre going to burn,jpg,"gay,homophobic dog,homophobia"
303,http://127.0.0.1:5001/local/meme/303,vecna in one piece dress,jpg,"vecna,gay,slay,ate,cleared,cunty,stranger things"
304,http://127.0.0.1:5001/local/meme/304,dragged to hell,jpg,"new rockstars,thumbnail,wanda,scarlett witch"
305,http://127.0.0.1:5001/local/meme/305,dog with under bite,jpg,"confused,dumb,concerned,weird,help,tired"
306,http://127.0.0.1:5001/local/meme/306,fairly odd parents over it,jpg,"done,tired,sad,over it"
308,http://127.0.0.1:5001/local/meme/308,dog rejecting vegetables,jpg,"dog,over it,sad,tired"
309,http://127.0.0.1:5001/local/meme/309,help her meme,png,"tired,done,over it,help"
310,http://127.0.0.1:5001/local/meme/310,scarlett witch smiling at strange,jpg,"scarlett witch,smiling,excited,happy"
311,http://127.0.0.1:5001/local/meme/311,stop being gay,jpg,"gay,homophobia"
312,http://127.0.0.1:5001/local/meme/312,are you gay dog,png,"gay,rainbow flag,lgbt,suspicious,concerned"
313,http://127.0.0.1:5001/local/meme/313,you served now what,jpg,"slay,ate,cleared,cunty,happy,satisfied"
314,http://127.0.0.1:5001/local/meme/314,fletcher confused,jpg,"fletcher,ant farm,confused,concerned,gagged,embarassed"
315,http://127.0.0.1:5001/local/meme/315,fletcher explaining himself,jpg,"fletcher,ant farm,confused,concerned"
316,http://127.0.0.1:5001/local/meme/316,fletcher smirking,jpg,"fletcher,ant farm,happy,excited,satisfied,ate,cleared"
317,http://127.0.0.1:5001/local/meme/317,fletcher standing still,jpg,"fletcher,ant farm,gagged,embarassed"
318,http://127.0.0.1:5001/local/meme/318,fletcher looking confused,jpg,"fletcher,ant farm,confused,concerned"
319,http://127.0.0.1:5001/local/meme/319,tiger shocked being let out of cage,jpg,"tiger,shocked,scared,embarassed,gagged"
321,http://127.0.0.1:5001/local/meme/321,guy with bomb staring at phone,jpg,"batman,tired,done,over it,stress,unhappy"
322,http://127.0.0.1:5001/local/meme/322,spongebob double eyed meme,jpg,"spongebob,books,confused"
323,http://127.0.0.1:5001/local/meme/323,girl getting side eye,jpg,"girl,suspicious,side eye,embarassed,gagged"
324,http://127.0.0.1:5001/local/meme/324,girl with heart at her crotch,jpg,"horny,happy,love,attractive,inlove"
325,http://127.0.0.1:5001/local/meme/325,drake with nails,png,"bbl drake,drake,gay,cunty"
326,http://127.0.0.1:5001/local/meme/326,bbl drake getting a drink,png,"drake,gay,cunty,slay"
327,http://127.0.0.1:5001/local/meme/327,bbl drake selfie,png,"drake,gay"
328,http://127.0.0.1:5001/local/meme/328,ice age characters shocked,jpg,"shocked,surprised,done"
329,http://127.0.0.1:5001/local/meme/329,and are they in the room with us right now,jpg,"mental illness,ill,questioning,imaginary"
330,http://127.0.0.1:5001/local/meme/330,bbl drake in bed,png,"drake,bonnet,bbl drake,gay,peace,satisfied"
331,http://127.0.0.1:5001/local/meme/331,of course I cum fast I got places to be,jpg,"soldier boy,the boys"
332,http://127.0.0.1:5001/local/meme/332,fletcher but with yassified face,jpg,"fletcher,embarassed,confused,concerned"
334,http://127.0.0.1:5001/local/meme/334,cat giving side eye,png,"cat,side eye,suspicious,concerned,confused"
335,http://127.0.0.1:5001/local/meme/335,fighting the gay allegations again,jpg,"wolf,loner,gay,struggling"
336,http://127.0.0.1:5001/local/meme/336,fighting the urge to make out with men,jpg,"wolf,loner,gay,struggling"
337,http://127.0.0.1:5001/local/meme/337,people praying along with a dog,jpg,"praying,dog,hope"
338,http://127.0.0.1:5001/local/meme/338,worst tweet ever,jpg,"new rockstars,thumbnail,worst tweet"
339,http://127.0.0.1:5001/local/meme/339,welcome to rizz academy,jpg,"rizz,happy,excited"
340,http://127.0.0.1:5001/local/meme/340,racoon screaming,jpg,"racoon,screaming,stressed,help,done,"
341,http://127.0.0.1:5001/local/meme/341,woman holding screaming racoon,jpg,"racoon,screaming,stressed,help,done,"
342,http://127.0.0.1:5001/local/meme/342,are you gay cat,jpg,"cat,suspicious,gay,rainbow flag"
343,http://127.0.0.1:5001/local/meme/343,are you gay dog,jpg,"dog,suspicious,gay,rainbow flag"
344,http://127.0.0.1:5001/local/meme/344,horse in car crash,jpg,"horse,car,tired,done,over it,stressed"
345,http://127.0.0.1:5001/local/meme/345,its mathematics luv,jpg,"british,mathematics,satisfied,ate,cleared"
346,http://127.0.0.1:5001/local/meme/346,youre gay transylvannia,jpg,"gay,dracula,hotel transylvannia,rainbow flag"
347,http://127.0.0.1:5001/local/meme/347,wednesday are you gay,jpg,"gay,suspicious,rainbow flag,Wednesday,netflix"
348,http://127.0.0.1:5001/local/meme/348,lgtv dog,jpg,"dog,concerned,confused,gay,suspicious,help"
349,http://127.0.0.1:5001/local/meme/349,cock by freddy fazebear,jpg,"horny,cock,freddy,fnaf"
351,http://127.0.0.1:5001/local/meme/351,are you gay horse,jpg,"horse,gay,suspicious,rainbow flag"
352,http://127.0.0.1:5001/local/meme/352,are you gay cat,jpg,"cat,gay,suspicious,rainbow flag"
353,http://127.0.0.1:5001/local/meme/353,chicken are you gay,jpg,"chicken,gay,suspicious,rainbow flag"
354,http://127.0.0.1:5001/local/meme/354,soldier boy fuck you,jpg,"soldier boy,the boys,bold,satisfied,cleared,ate"
357,http://127.0.0.1:5001/local/meme/357,its a chicken salad,jpg,"chicken salad,ate,cleared,happy,excited,shh,period"
359,http://127.0.0.1:5001/local/meme/359,tyler the creator shocked,jpg,"shocked,surprised,done,scared,gagged"
362,http://127.0.0.1:5001/local/meme/362,wanda dancing lgbt,mp4,"dancing,happy,cleared,wanda,scarlett witch"
363,http://127.0.0.1:5001/local/meme/363,millie bobby brown crying at rainbow flag,mp4,"gay,homophobia,rainbow flag,lgbt,crying,sad,millie"
364,http://127.0.0.1:5001/local/meme/364,eating burger and then getting sick,mp4,"disgusted,sad,gagged,disgusting,burger,vomit"
366,http://127.0.0.1:5001/local/meme/366,icespice scream cross over,mp4,"ice spice,scream,dancing,scary"
367,http://127.0.0.1:5001/local/meme/367,dog moving around in apartment timelapse,mp4,"dog,excited,fast,stressed,happy,excited"
368,http://127.0.0.1:5001/local/meme/368,shehulk clapping boom sound,mp4,"vine,vine boom,shehulk,marvel,mcu"
369,http://127.0.0.1:5001/local/meme/369,pizza hut worker tying apron,mp4,"thick,cunt,happy,cleared,ate,gagged,gay"
370,http://127.0.0.1:5001/local/meme/370,elena getting slapped,mp4,"vampire diaries.beyonce,unique,slapped,gagged,cleared,tvd"
371,http://127.0.0.1:5001/local/meme/371,witches dancing to jays on my feet,mp4,"witches,dancing,halloween,miley cyrus,happy,excited"
372,http://127.0.0.1:5001/local/meme/372,are you gay cow,jpg,"gay,suspicious,rainbow flag,cow"
373,http://127.0.0.1:5001/local/meme/373,shut up your mouth obama,mp4,"obama,egypt,egyptian women"
374,http://127.0.0.1:5001/local/meme/374,but im loyal to viltrum not this pathetic excuse for a civilization,mp4,"omniman,viltrum,done,loner,over it,tired"
375,http://127.0.0.1:5001/local/meme/375,zods wife screaming for her husband,mp4,"husband,young justice,horny,inlove,married"
376,http://127.0.0.1:5001/local/meme/376,mother takes daughters pen away while writing,mp4,"yapping,too much,tired,done,gagged,cleared"
377,http://127.0.0.1:5001/local/meme/377,I crossdress in a wonderwoman outfit it makes me feel powerful,mov,"honest,gagged,power,woman,hot,horny"
378,http://127.0.0.1:5001/local/meme/378,woman screaming n word,mp4,"woman,racist,karen,screaming"
380,http://127.0.0.1:5001/local/meme/380,shout out to all my gay niggas,mp4,"gay,period,ate,cleared"
381,http://127.0.0.1:5001/local/meme/381,be who you are for your pride,mp4,"gay,pride,happy,rainbow flag,be who you are"
382,http://127.0.0.1:5001/local/meme/382,dog growling,mp4,"dog,angry,scared,concerned"
383,http://127.0.0.1:5001/local/meme/383,ellen audience celebrating,mp4,"ellen,happy,excited,screaming,fun,celebrating"
384,http://127.0.0.1:5001/local/meme/384,scarlett witch cunty walk,mp4,"scarlett witch,wanda,cunt,serving"
385,http://127.0.0.1:5001/local/meme/385,bad bad bad idea,mov,"gorrilla glue girl,bad idea,stupid,dumb"
386,http://127.0.0.1:5001/local/meme/386,not on my watch,mp4,"not on my watch,clocked,concerned,confused"
388,http://127.0.0.1:5001/local/meme/388,thanos screaming but with ariana whistle note,mp4,"thanos,mcu,ariana grande,screaming,singing"
389,http://127.0.0.1:5001/local/meme/389,monkey in dress,mp4,"happy,ate,serving,cleared,satisfied"
390,http://127.0.0.1:5001/local/meme/390,cops dancing in elevator,mp4,"cops,police,happy,fun,dancing,satisfied"
392,http://127.0.0.1:5001/local/meme/392,I never said lgbt last night I said sin,mp4,"gay,lgbt,homophobia,homophobic,christian"
393,http://127.0.0.1:5001/local/meme/393,darwin insulting someone really fast,mp4,"darwin,gumball,disgusted,angry,mad,ate,cleared"
394,http://127.0.0.1:5001/local/meme/394,girl crying but spotify ads stop her,mp4,"sad,crying,drama,gagged,embarassed"
395,http://127.0.0.1:5001/local/meme/395,when I catch you let me tell you what I am going to do,mp4,"tokyo toni,soloplex,stomp your face into the cement,be prepared,mouth,fight,beat,angry"
396,http://127.0.0.1:5001/local/meme/396,cat staring at someone ominously,mp4,"cat,staring,concerned,confused,side eye,suspicious"
397,http://127.0.0.1:5001/local/meme/397,family guy peter being strapped while listening to adele,mp4,"family guy,sad,crying,music,good,help"
398,http://127.0.0.1:5001/local/meme/398,kim getting thrown into water turning into beyonce,mp4,"kim kardashian,kim,beyonce,gagged,embarassed,I tried to change"
399,http://127.0.0.1:5001/local/meme/399,cardi b giving side eye,mp4,"cardi b,side eye,suspicious,concerned,confused"
400,http://127.0.0.1:5001/local/meme/400,icarly getting blindsided with bright light,mp4,"icarly,blind,blinded,bright light,screaming,too white"
401,http://127.0.0.1:5001/local/meme/401,death drop everyone celebrating,mp4,"gagged,cleared,ate,dancing"
402,http://127.0.0.1:5001/local/meme/402,man in suit posing video,mp4,"happy,excited,pleased,satisfied,cleared,ate"
403,http://127.0.0.1:5001/local/meme/403,beyonce mirror breaking video with jiafei,mp4,"beyonce,jia fei,jiafei,happy,excited"
404,http://127.0.0.1:5001/local/meme/404,bonnie incendia people in car burnt,mp4,"bonnie,tvd,the vampire diaries,ate,cleared"
406,http://127.0.0.1:5001/local/meme/406,nollywood youre a disappointment,mp4,"nollywood,nigerian,disappointment,crazy"
407,http://127.0.0.1:5001/local/meme/407,woman disintegrating I have to go,mp4,"gone,sad,happy,excited,embarassed,help"
408,http://127.0.0.1:5001/local/meme/408,nun if I miss I slay,mp4,"ate,cleared,nun,slay,serving,gay"
409,http://127.0.0.1:5001/local/meme/409,lego green lantern shaking ass,mp4,"lego,justice league,dc,green lantern,dancing,happy,fun,shaking ass,twerking"
411,http://127.0.0.1:5001/local/meme/411,im out here sweating my ass of to keep my black from cracking,mp4,"baby girls,love you"
412,http://127.0.0.1:5001/local/meme/412,cat being shocked at another cat,mp4,"cat,shocked,surprised,deadass,serious,sad,gagged"
413,http://127.0.0.1:5001/local/meme/413,be who you are for your pride,mp4,"gay,pride,pride month"
414,http://127.0.0.1:5001/local/meme/414,tokyo toni alexa kill yourself,mp4,"alexa,tokyo toni,done,tired,deadass"
415,http://127.0.0.1:5001/local/meme/415,thats supsicious thats weird,mp4,"cardi b,suspicious,concerned,confused,weird"
416,http://127.0.0.1:5001/local/meme/416,suspicious side eye montage,mp4,"suspicious,confused,concerned,side eye"
417,http://127.0.0.1:5001/local/meme/417,nollywood skeleton disappearing with woman,mp4,"nollywood,nigerian,witchcraft,inlove,help"
418,http://127.0.0.1:5001/local/meme/418,gorilla running in the rain,mp4,"gorilla,monkey,raining,embarassed,sad,gagged"
419,http://127.0.0.1:5001/local/meme/419,millie bobby brown I am homophobic,mp4,"homophobic,gay,homophobia,millie bobby brown"
420,http://127.0.0.1:5001/local/meme/420,dog giving side eye with among us background sound,mp4,"dog,suspicious,concerned,side eye,confused"
421,http://127.0.0.1:5001/local/meme/421,homelander im smarter im better I am better,mp4,"homelander,superior,the boys"
422,http://127.0.0.1:5001/local/meme/422,wig video,mp4,"wig,ate,cleared"
423,http://127.0.0.1:5001/local/meme/423,ariel and donald duck and pooh dancing,mp4,"dancing,pooh,happy,excited"
424,http://127.0.0.1:5001/local/meme/424,tiger eating with bbl finger pose,mp4,"tiger,ate,cleared,serving,gay"
425,http://127.0.0.1:5001/local/meme/425,woman being dramatic over fake accident,mp4,"woman,crying,karen,sad,scared"
426,http://127.0.0.1:5001/local/meme/426,can you vote video,mp4,"vote,no,video"
427,http://127.0.0.1:5001/local/meme/427,chiropractor slamming rod into someones neck,mp4,"chiropractor,crazy,help,angry,mad,tired"
428,http://127.0.0.1:5001/local/meme/428,man slipping on ice and landing onto pack of water,mp4,"gagged,slipped,embarassed,help,confused"
429,http://127.0.0.1:5001/local/meme/429,im an nyu film school graduate rating spongebob,mp4,"spongebob,film,film critic"
430,http://127.0.0.1:5001/local/meme/430,black panther cast confused,mp4,"black panther,suspicious,side eye,confused,concerned"
432,http://127.0.0.1:5001/local/meme/432,iris edit she ate,mov,"iris,ate,cleared,gagged"
433,http://127.0.0.1:5001/local/meme/433,so when yall are drinking blood how does that work do you put sugar in it,mp4,"tokyo toni,blood,illuminati,sugar in it,how does that work"
434,http://127.0.0.1:5001/local/meme/434,listen to youre voice the way youre talking you sound like a female,mp4,"gay,homophobia,lgbt,homophobic,misogynistic"
435,http://127.0.0.1:5001/local/meme/435,right infront of my salad,mp4,"gay,homophobia,salad,embarassed,pride,pride month"
436,http://127.0.0.1:5001/local/meme/436,bumble bee twerking,mp4,"twerking,dancing,excited,happy,help"
437,http://127.0.0.1:5001/local/meme/437,I have my half up half down am I giving ariani am I giving arianka or no,mp4,"azealia banks,ate,ariana grande,happy"
438,http://127.0.0.1:5001/local/meme/438,cat being shocked at another cat,mp4,"cat,shocked,surprised,deadass,serious,sad,gagged"
439,http://127.0.0.1:5001/local/meme/439,oh hell no showing gun knife taser,mp4,"gun,knife,fight,angry,taser"
440,http://127.0.0.1:5001/local/meme/440,girl with bob saying hello,mp4,"girl,bob,hello,ate,serving,hair,wig"
441,http://127.0.0.1:5001/local/meme/441,have you showered or bathed in the last couple of days,mp4,"shower,bathed,confused,concerned,dirty,messy"
442,http://127.0.0.1:5001/local/meme/442,drake dancing,mp4,"drake,gay,bbl drake"
443,http://127.0.0.1:5001/local/meme/443,tokyo toni why dont you take your kids and your dog,mp4,"tokyo toni,get to the bottom dig deep,insult,angry,help"
444,http://127.0.0.1:5001/local/meme/444,nun with slay fit,mp4,"nun,slay,ate,cleared,gagged,outfit,serving"
445,http://127.0.0.1:5001/local/meme/445,cat with a bob,mp4,"cat,bob,wig,slay,serving,nicki minaj"
446,http://127.0.0.1:5001/local/meme/446,rest in peace to the chicks that are dying to be me,mp4,"ate,cleared,proud,satisfied,serving"
447,http://127.0.0.1:5001/local/meme/447,cat making weird sounds,mp4,"cat,weird,hungry,help,confused"
448,http://127.0.0.1:5001/local/meme/448,jia fei birthday cake,mp4,"jia fei,jiafei,birthday,cake,celebrating"
449,http://127.0.0.1:5001/local/meme/449,wanda getting beat up by nicki ariana and beyonce,mp4,"wanda,scarlett witch,beat up,gagged,beyonce,nicki minaj,ariana grande"
450,http://127.0.0.1:5001/local/meme/450,wendy williams and abby lee miller dancing,mp4,"wendy williams,abby lee miller,dancing,ate,cleared,happy,excited,satisfied"
451,http://127.0.0.1:5001/local/meme/451,I aint got no tail gurl,mp4,"tail,gagged,help,cleared"
452,http://127.0.0.1:5001/local/meme/452,woman singing into mic and cutting out,mp4,"singing,celebrating,gagged,happy,fun"
453,http://127.0.0.1:5001/local/meme/453,dog getting sad seeing its reflection,mp4,"dog,gagged,sad,confused,concerned,help,embarassed"
454,http://127.0.0.1:5001/local/meme/454,wanda waking up from dream sad,mp4,"wanda,scarlett witch,dream,sad,delusion,delulu,confused"
455,http://127.0.0.1:5001/local/meme/455,homelander watching movie sad,mp4,"homelander,the boys,sad,done,over it,dissociating,checked out"
456,http://127.0.0.1:5001/local/meme/456,olivia wilde satisfied after doing protest,mp4,"olivia wilde,satisfied,protest,we love america,ate,cleared,happy"
457,http://127.0.0.1:5001/local/meme/457,mr crabs going to chum bucket and then explosion,mp4,"skimbabimdede,explosion,spongebob,crab,excited,happy"
458,http://127.0.0.1:5001/local/meme/458,people saying mental slurs,mp4,"gay,homophobic,homophobia,slurs,lgbt"
459,http://127.0.0.1:5001/local/meme/459,man throwing woman off boat because of pregnancy test,mp4,"angry,confused,concerned,suspcious"
